{
  "schema_version": "1.0.0",
  "audit_id": "f47ac10b-58cc-4372-a567-0e02b2c3d479",
  "started_at": "2026-05-27T10:00:00Z",
  "updated_at": "2026-05-27T15:30:00Z",
  "scope": {
    "project_name": "Phoenix Financial OS",
    "scope_description": "AI-native Mexican fintech platform. Audit for production launch readiness with focus on CNBV ITF registration eligibility.",
    "exclusions": ["legacy migration scripts", "internal admin tools (separate audit)"],
    "geographic_scope": ["MX", "US"],
    "industry": "fintech",
    "compliance_frameworks_in_scope": [
      "CNBV CUF/CUIFPEs", "LFPDPPP 2025", "SAT CFF",
      "OWASP ASVS 5.0 L3", "OWASP API Top 10 2023",
      "PCI-DSS 4.0.1", "SOC 2", "ISO 27001"
    ]
  },
  "current_phase": 3,
  "phases": {
    "0": {
      "status": "complete",
      "started_at": "2026-05-27T10:00:00Z",
      "completed_at": "2026-05-27T10:45:00Z",
      "deliverable_path": ".pantheon/sow.md",
      "personas_dispatched": ["pantheon-orchestrator"]
    },
    "1": {
      "status": "complete",
      "started_at": "2026-05-27T10:45:00Z",
      "completed_at": "2026-05-27T12:30:00Z",
      "deliverable_path": ".pantheon/phase-outputs/01-architecture-review.md",
      "personas_dispatched": ["mudge-holistic", "latacora-pragmatic"]
    },
    "2": {
      "status": "complete",
      "started_at": "2026-05-27T12:30:00Z",
      "completed_at": "2026-05-27T14:00:00Z",
      "deliverable_path": ".pantheon/phase-outputs/02-strategic-threat-model.md",
      "personas_dispatched": ["mudge-holistic", "project-zero-researcher"]
    },
    "3": {
      "status": "in-progress",
      "started_at": "2026-05-27T14:00:00Z",
      "personas_dispatched": ["trail-of-bits-auditor", "ncc-group-auditor", "cure53-web-app"]
    },
    "4": {"status": "pending"},
    "5": {"status": "pending"},
    "6": {"status": "pending"},
    "7": {"status": "pending"},
    "8": {"status": "pending"},
    "9": {"status": "pending"},
    "10": {"status": "pending"},
    "11": {"status": "pending"},
    "12": {"status": "pending"}
  },
  "findings": [
    {
      "id": "PANTHEON-0001",
      "title": "Hardcoded JWT signing secret in default config",
      "severity": "Critical",
      "status": "accepted"
    },
    {
      "id": "PANTHEON-0042",
      "title": "JWT algorithm confusion enables admin impersonation",
      "severity": "Critical",
      "status": "accepted"
    },
    {
      "id": "PANTHEON-0043",
      "title": "SQL injection in legacy reporting endpoint",
      "severity": "High",
      "status": "withdrawn",
      "adversarial_gate": {
        "verdict": "WITHDRAW",
        "notes": "Defense in depth catches this. Parameterized query layer middleware blocks attempted injection at line 38 of query-builder.ts. Verified."
      }
    }
  ],
  "maturity_scorecard": {
    "dimension_1": {
      "name": "Arithmetic and decimal precision",
      "rating": "Satisfactory",
      "evidence": "All money uses Decimal type with 4-decimal precision (apps/api/src/domain/money.ts). Overflow checks present.",
      "improvement_priority": "P3"
    }
  },
  "deliverables_generated": false,
  "deliverables_path": "",
  "launch_decision": "PENDING"
}
